{"$schema":"https://json-schema.org/draft/2020-12/schema","$id":"https://securethecloud.dev/schemas/portfolio/authority_matrix.schema.json","title":"SecureTheCloud Authority Matrix Contract","type":"object","required":["contract_name","contract_version","doctrine_phase","last_updated","sharing_status","canonical_rules","universal_forbidden_actions","authority_rows"],"additionalProperties":false,"properties":{"contract_name":{"const":"securethecloud_authority_matrix"},"contract_version":{"type":"string"},"doctrine_phase":{"type":"string"},"last_updated":{"type":"string","pattern":"^\\d{4}-\\d{2}-\\d{2}$"},"sharing_status":{"type":"string","enum":["active_machine_readable_contract"]},"canonical_rules":{"type":"array","minItems":1,"items":{"type":"string"}},"universal_forbidden_actions":{"type":"array","minItems":1,"items":{"type":"string"}},"authority_rows":{"type":"array","minItems":1,"items":{"type":"object","required":["module_id","authority_type","callable_interfaces","forbidden_actions","runtime_authority","sentinel_required_for_runtime_control"],"additionalProperties":false,"properties":{"module_id":{"type":"string","pattern":"^[a-z0-9_]+$"},"authority_type":{"type":"string"},"callable_interfaces":{"type":"array","minItems":1,"items":{"type":"string"}},"forbidden_actions":{"type":"array","minItems":1,"items":{"type":"string"}},"runtime_authority":{"type":"boolean"},"sentinel_required_for_runtime_control":{"type":"boolean"}}}}}}
