{
  "contract_name": "securethecloud_authority_matrix",
  "contract_version": "0.7.0-aegis-riskdna-doctrine-delta",
  "doctrine_phase": "Phase 7 / Aegis Runtime RiskDNA Doctrine Delta",
  "last_updated": "2026-05-26",
  "sharing_status": "active_machine_readable_contract",
  "canonical_rules": [
    "No module may claim authority outside this matrix.",
    "Suite membership does not create authority.",
    "Packaging does not create authority.",
    "Composition does not create authority.",
    "Evidence does not create enforcement authority.",
    "Explanation does not create authorization authority.",
    "Runtime-impacting control outcomes remain under SENTINEL control-point doctrine."
  ],
  "universal_forbidden_actions": [
    "issuing_tokens",
    "granting_authorization",
    "creating_runtime_sessions",
    "mutating_provider_resources",
    "mutating_kubernetes_resources",
    "executing_helm_deployments",
    "exposing_live_backend_apis",
    "performing_production_traffic_cutover",
    "enforcing_runtime_allow_deny_decisions",
    "bypassing_sentinel",
    "inventing_suite_membership",
    "inventing_authority",
    "inventing_status_taxonomy_values",
    "claiming_soc2_certification_from_alignment_docs"
  ],
  "authority_rows": [
    {
      "module_id": "doctrine_control_plane",
      "authority_type": "doctrine_only",
      "callable_interfaces": [
        "read_doctrine",
        "read_registry"
      ],
      "forbidden_actions": [
        "runtime_adapter_code",
        "helm_templates",
        "ui_website_assets",
        "module_specific_enforcement_logic",
        "live_backend_integration"
      ],
      "runtime_authority": false,
      "sentinel_required_for_runtime_control": true
    },
    {
      "module_id": "portfolio_doctrine",
      "authority_type": "doctrine_only",
      "callable_interfaces": [
        "read_doctrine"
      ],
      "forbidden_actions": [
        "runtime_authority",
        "suite_execution",
        "customer_enforcement_claims"
      ],
      "runtime_authority": false,
      "sentinel_required_for_runtime_control": true
    },
    {
      "module_id": "shared_trust_fabric",
      "authority_type": "shared_contract",
      "callable_interfaces": [
        "read_registry",
        "read_doctrine"
      ],
      "forbidden_actions": [
        "standalone_customer_suite_packaging",
        "runtime_mutation",
        "enforcement"
      ],
      "runtime_authority": false,
      "sentinel_required_for_runtime_control": true
    },
    {
      "module_id": "composition_layer",
      "authority_type": "composition_only",
      "callable_interfaces": [
        "compose_package",
        "present_customer_safe",
        "read_registry"
      ],
      "forbidden_actions": [
        "creating_authority",
        "bypassing_sentinel",
        "runtime_enforcement",
        "token_issuance"
      ],
      "runtime_authority": false,
      "sentinel_required_for_runtime_control": true
    },
    {
      "module_id": "sentinel_control_point",
      "authority_type": "control_point_canonical",
      "callable_interfaces": [
        "control_point_reference",
        "read_doctrine"
      ],
      "forbidden_actions": [
        "live_enforcement_claims_without_phase_approval",
        "local_substitute_control_points",
        "silent_bypass"
      ],
      "runtime_authority": false,
      "sentinel_required_for_runtime_control": true
    },
    {
      "module_id": "suite_catalog",
      "authority_type": "shared_contract",
      "callable_interfaces": [
        "read_registry",
        "read_doctrine"
      ],
      "forbidden_actions": [
        "inventing_customer_suites",
        "runtime_authority",
        "enforcement_claims"
      ],
      "runtime_authority": false,
      "sentinel_required_for_runtime_control": true
    },
    {
      "module_id": "module_authority_matrix",
      "authority_type": "shared_contract",
      "callable_interfaces": [
        "read_registry",
        "read_doctrine"
      ],
      "forbidden_actions": [
        "granting_runtime_authority_without_doctrine_update",
        "local_overrides"
      ],
      "runtime_authority": false,
      "sentinel_required_for_runtime_control": true
    },
    {
      "module_id": "status_taxonomy",
      "authority_type": "shared_contract",
      "callable_interfaces": [
        "read_registry",
        "read_doctrine"
      ],
      "forbidden_actions": [
        "inventing_local_statuses",
        "runtime_authority"
      ],
      "runtime_authority": false,
      "sentinel_required_for_runtime_control": true
    },
    {
      "module_id": "product_packaging_boundaries",
      "authority_type": "doctrine_only",
      "callable_interfaces": [
        "read_doctrine",
        "compose_package"
      ],
      "forbidden_actions": [
        "merging_suite_roles",
        "expanding_authority_through_packaging",
        "soc2_certification_claims"
      ],
      "runtime_authority": false,
      "sentinel_required_for_runtime_control": true
    },
    {
      "module_id": "agent_blackbox_suite_shell",
      "authority_type": "composition_only",
      "callable_interfaces": [
        "present_customer_safe",
        "compose_package",
        "explain_posture"
      ],
      "forbidden_actions": [
        "runtime_mutation",
        "authorization",
        "enforcement",
        "sentinel_bypass"
      ],
      "runtime_authority": false,
      "sentinel_required_for_runtime_control": true
    },
    {
      "module_id": "agent_decision_evidence",
      "authority_type": "evidence_read_only",
      "callable_interfaces": [
        "read_evidence",
        "present_customer_safe",
        "explain_posture"
      ],
      "forbidden_actions": [
        "changing_decisions",
        "authorizing_agents",
        "enforcing_controls",
        "mutating_evidence_source_truth"
      ],
      "runtime_authority": false,
      "sentinel_required_for_runtime_control": true
    },
    {
      "module_id": "agent_handoff_context",
      "authority_type": "evidence_read_only",
      "callable_interfaces": [
        "read_evidence",
        "present_customer_safe",
        "explain_posture"
      ],
      "forbidden_actions": [
        "marking_handoffs_used",
        "runtime_handoff_mutation",
        "authorization",
        "enforcement"
      ],
      "runtime_authority": false,
      "sentinel_required_for_runtime_control": true
    },
    {
      "module_id": "agent_trust_intelligence_summary",
      "authority_type": "explanation_read_only",
      "callable_interfaces": [
        "read_evidence",
        "present_customer_safe",
        "explain_posture"
      ],
      "forbidden_actions": [
        "inventing_evidence",
        "producing_enforcement_outcomes",
        "issuing_trust_credentials"
      ],
      "runtime_authority": false,
      "sentinel_required_for_runtime_control": true
    },
    {
      "module_id": "compliance_evidence_suite_shell",
      "authority_type": "composition_only",
      "callable_interfaces": [
        "present_customer_safe",
        "present_auditor_safe",
        "compose_package"
      ],
      "forbidden_actions": [
        "runtime_enforcement",
        "authorization",
        "soc2_certification_claims"
      ],
      "runtime_authority": false,
      "sentinel_required_for_runtime_control": true
    },
    {
      "module_id": "soc2_alignment_evidence",
      "authority_type": "evidence_read_only",
      "callable_interfaces": [
        "read_evidence",
        "present_auditor_safe",
        "explain_posture"
      ],
      "forbidden_actions": [
        "claiming_soc2_certification",
        "mutating_controls",
        "runtime_enforcement"
      ],
      "runtime_authority": false,
      "sentinel_required_for_runtime_control": true
    },
    {
      "module_id": "soc2_control_traceability",
      "authority_type": "evidence_read_only",
      "callable_interfaces": [
        "read_evidence",
        "present_auditor_safe",
        "explain_posture"
      ],
      "forbidden_actions": [
        "certifying_audit_results",
        "creating_runtime_controls",
        "overriding_authority_matrix"
      ],
      "runtime_authority": false,
      "sentinel_required_for_runtime_control": true
    },
    {
      "module_id": "audit_workspace",
      "authority_type": "evidence_read_only",
      "callable_interfaces": [
        "read_evidence",
        "present_auditor_safe"
      ],
      "forbidden_actions": [
        "new_export_generation_unless_approved",
        "runtime_enforcement",
        "token_session_issuance"
      ],
      "runtime_authority": false,
      "sentinel_required_for_runtime_control": true
    },
    {
      "module_id": "soc2_export_manifest",
      "authority_type": "evidence_packaging",
      "callable_interfaces": [
        "package_evidence",
        "present_auditor_safe"
      ],
      "forbidden_actions": [
        "creating_evidence_truth",
        "signing_bundles_unless_approved",
        "claiming_certification"
      ],
      "runtime_authority": false,
      "sentinel_required_for_runtime_control": true
    },
    {
      "module_id": "pdf_report_package",
      "authority_type": "evidence_packaging",
      "callable_interfaces": [
        "package_evidence",
        "present_customer_safe",
        "present_auditor_safe"
      ],
      "forbidden_actions": [
        "regenerating_production_reports_without_approval",
        "signing",
        "enforcement_claims"
      ],
      "runtime_authority": false,
      "sentinel_required_for_runtime_control": true
    },
    {
      "module_id": "signed_bundle_manifest",
      "authority_type": "evidence_packaging",
      "callable_interfaces": [
        "package_evidence",
        "present_auditor_safe"
      ],
      "forbidden_actions": [
        "cryptographic_signing_unless_explicitly_approved",
        "changing_evidence_source_truth",
        "enforcement_claims"